{
  "schemaVersion": 1,
  "logicalVersion": "v1.16.1",
  "dataset": "economy",
  "generator": "tools/migration/canonical_data.py",
  "sources": [
    {
      "path": "legacy/web-prototype/data/economy.json",
      "sha256": "32087569897f9aa012d2bbf282d1b57ad902326f9c5cb5ea38b4507bc112d49a",
      "normalization": "utf8_lf"
    }
  ],
  "records": [
    {
      "id": "legacy_economy",
      "role": "constants_only",
      "values": {
        "starting_player_hp": 100,
        "starting_coins": 300,
        "base_income": 300,
        "reroll_cost": 20,
        "random_card_cost": 100,
        "interest_per_100": 10,
        "interest_cap": 100,
        "win_reward": 50,
        "win_streak_per_win": 20,
        "win_streak_cap": 100,
        "loss_hp_compensation": 15,
        "lose_streak_per_loss": 15,
        "lose_streak_cap": 60,
        "branch_thresholds": [
          4,
          10,
          20,
          40
        ]
      },
      "provenance": {
        "source": "legacy/web-prototype/data/economy.json",
        "pointer": "/",
        "sourceSha256": "32087569897f9aa012d2bbf282d1b57ad902326f9c5cb5ea38b4507bc112d49a"
      }
    }
  ]
}
